{"version": 8, "start_month": "2016-12", "end_month": "2026-10", "reviewers": {"arsenm": {"avatar_url": "https://avatars.githubusercontent.com/u/138339?v=4", "monthly": {"2025-04": 260, "2025-05": 360, "2025-06": 256, "2025-07": 285, "2025-08": 308, "2025-09": 300, "2025-10": 257, "2025-11": 277, "2025-12": 229, "2026-01": 353, "2023-09": 78, "2023-10": 92, "2023-11": 163, "2023-12": 111, "2024-01": 198, "2024-02": 154, "2024-03": 206, "2024-04": 160, "2024-05": 197, "2024-06": 186, "2024-07": 199, "2024-08": 211, "2024-09": 277, "2024-10": 258, "2024-11": 212, "2024-12": 201, "2025-01": 236, "2025-02": 271, "2025-03": 294, "2026-02": 295, "2026-03": 255, "2026-04": 354, "2026-05": 308, "2026-06": 270, "2026-07": 356, "2026-08": 309, "2026-09": 372, "2026-10": 333}, "comment_monthly": {"2025-04": 267, "2025-05": 371, "2025-06": 262, "2025-07": 298, "2025-08": 318, "2025-09": 312, "2025-10": 268, "2025-11": 289, "2025-12": 238, "2026-01": 366, "2023-09": 96, "2023-10": 96, "2023-11": 173, "2023-12": 116, "2024-01": 205, "2024-02": 159, "2024-03": 212, "2024-04": 171, "2024-05": 204, "2024-06": 196, "2024-07": 208, "2024-08": 219, "2024-09": 287, "2024-10": 270, "2024-11": 220, "2024-12": 213, "2025-01": 246, "2025-02": 281, "2025-03": 309, "2026-02": 315, "2026-03": 265, "2026-04": 363, "2026-05": 327, "2026-06": 282, "2026-07": 370, "2026-08": 315, "2026-09": 379, "2026-10": 344}, "merge_monthly": {"2024-05": 1, "2023-12": 3, "2023-09": 2, "2024-02": 5, "2024-03": 5, "2023-11": 5, "2024-01": 8, "2024-04": 3, "2024-07": 4, "2025-01": 2, "2024-11": 3, "2024-12": 6, "2024-08": 5, "2025-03": 5, "2025-02": 8, "2024-10": 10, "2024-09": 3, "2025-04": 5, "2025-05": 5, "2025-06": 3, "2025-09": 9, "2025-12": 11, "2025-08": 3, "2025-11": 3, "2025-10": 9, "2025-07": 2, "2026-01": 11, "2026-02": 4, "2026-03": 3, "2026-04": 5, "2026-05": 4, "2026-06": 4, "2026-07": 5, "2026-08": 3, "2026-09": 2, "2026-10": 3}}, "nikic": {"avatar_url": "https://avatars.githubusercontent.com/u/216080?v=4", "monthly": {"2025-06": 173, "2025-07": 166, "2025-08": 140, "2025-09": 144, "2025-10": 131, "2025-11": 27, "2025-12": 124, "2026-01": 208, "2024-05": 102, "2024-06": 138, "2024-07": 151, "2024-08": 162, "2024-09": 246, "2024-10": 227, "2024-11": 176, "2024-12": 126, "2025-01": 222, "2025-02": 274, "2025-03": 172, "2025-04": 181, "2025-05": 150, "2023-08": 1, "2023-09": 74, "2023-10": 99, "2023-11": 139, "2023-12": 104, "2024-01": 90, "2024-02": 103, "2024-03": 114, "2024-04": 115, "2026-02": 119, "2026-03": 138, "2026-04": 121, "2026-05": 161, "2026-06": 208, "2026-07": 131, "2026-08": 101, "2026-09": 171, "2026-10": 249}, "comment_monthly": {"2025-05": 167, "2025-06": 189, "2025-07": 190, "2025-08": 170, "2025-09": 165, "2025-10": 150, "2025-11": 37, "2025-12": 148, "2026-01": 242, "2024-05": 136, "2024-06": 156, "2024-07": 171, "2024-08": 199, "2024-09": 272, "2024-10": 258, "2024-11": 199, "2024-12": 149, "2025-01": 246, "2025-02": 313, "2025-03": 187, "2025-04": 202, "2023-08": 1, "2023-09": 94, "2023-10": 112, "2023-11": 163, "2023-12": 120, "2024-01": 122, "2024-02": 130, "2024-03": 140, "2024-04": 137, "2026-02": 143, "2026-03": 157, "2026-04": 140, "2026-05": 178, "2026-06": 229, "2026-07": 144, "2026-08": 116, "2026-09": 196, "2026-10": 262}, "merge_monthly": {"2024-05": 10, "2023-12": 8, "2023-09": 4, "2024-02": 5, "2024-03": 4, "2023-11": 9, "2024-06": 8, "2024-01": 4, "2024-04": 10, "2024-07": 3, "2025-01": 1, "2024-11": 1, "2024-12": 2, "2024-08": 4, "2025-03": 2, "2025-02": 4, "2024-10": 4, "2024-09": 5, "2025-04": 7, "2025-05": 5, "2025-06": 4, "2025-09": 3, "2025-12": 13, "2025-08": 3, "2025-11": 1, "2025-10": 1, "2025-07": 4, "2026-01": 3, "2026-03": 7, "2026-04": 4, "2026-06": 3, "2026-07": 1, "2026-08": 2, "2026-09": 9, "2026-10": 7}}, "topperc": {"avatar_url": "https://avatars.githubusercontent.com/u/22566570?v=4", "monthly": {"2023-09": 72, "2023-10": 69, "2023-11": 88, "2023-12": 60, "2024-01": 82, "2024-02": 73, "2024-03": 96, "2024-04": 99, "2024-05": 63, "2024-06": 37, "2024-07": 89, "2024-08": 68, "2024-09": 67, "2024-10": 75, "2024-11": 80, "2024-12": 85, "2025-01": 76, "2025-02": 85, "2025-03": 81, "2025-04": 82, "2025-05": 76, "2025-06": 107, "2025-07": 117, "2025-08": 92, "2025-09": 77, "2025-10": 53, "2025-11": 82, "2025-12": 90, "2026-01": 113, "2026-02": 90, "2026-03": 64, "2026-04": 96, "2026-05": 66, "2026-06": 79, "2026-07": 86, "2026-08": 104, "2026-09": 133, "2026-10": 125}, "comment_monthly": {"2023-09": 82, "2023-10": 75, "2023-11": 97, "2023-12": 67, "2024-01": 96, "2024-02": 87, "2024-03": 118, "2024-04": 117, "2024-05": 73, "2024-06": 40, "2024-07": 104, "2024-08": 73, "2024-09": 70, "2024-10": 78, "2024-11": 86, "2024-12": 92, "2025-01": 85, "2025-02": 87, "2025-03": 88, "2025-04": 89, "2025-05": 82, "2025-06": 117, "2025-07": 124, "2025-08": 102, "2025-09": 80, "2025-10": 59, "2025-11": 89, "2025-12": 97, "2026-01": 122, "2026-02": 104, "2026-03": 72, "2026-04": 109, "2026-05": 69, "2026-06": 87, "2026-07": 89, "2026-08": 111, "2026-09": 141, "2026-10": 132}, "merge_monthly": {"2023-12": 1, "2024-02": 1, "2024-03": 3, "2024-06": 1, "2024-04": 1, "2024-07": 3, "2024-11": 2, "2024-12": 3, "2025-03": 2, "2025-04": 1, "2025-08": 2, "2025-11": 1, "2025-10": 1, "2026-01": 2, "2026-05": 1, "2026-06": 3, "2026-08": 1, "2026-09": 2, "2026-10": 1}}, "RKSimon": {"avatar_url": "https://avatars.githubusercontent.com/u/2175834?v=4", "monthly": {"2023-09": 55, "2023-10": 35, "2023-11": 33, "2023-12": 34, "2024-01": 36, "2024-02": 43, "2024-03": 83, "2024-04": 66, "2024-05": 58, "2024-06": 31, "2024-07": 65, "2024-08": 52, "2024-09": 48, "2025-10": 85, "2025-11": 102, "2025-12": 80, "2026-01": 118, "2024-10": 42, "2024-11": 54, "2024-12": 38, "2025-01": 49, "2025-02": 48, "2025-03": 57, "2025-04": 67, "2025-05": 40, "2025-06": 77, "2025-07": 84, "2025-08": 107, "2025-09": 117, "2026-02": 104, "2026-03": 118, "2026-04": 69, "2026-05": 81, "2026-06": 90, "2026-07": 98, "2026-08": 88, "2026-09": 132, "2026-10": 132}, "comment_monthly": {"2023-09": 61, "2023-10": 42, "2023-11": 39, "2023-12": 43, "2024-01": 40, "2024-02": 50, "2024-03": 96, "2024-04": 73, "2024-05": 69, "2024-06": 39, "2024-07": 70, "2024-08": 58, "2025-10": 85, "2025-11": 108, "2025-12": 84, "2026-01": 120, "2024-09": 53, "2024-10": 50, "2024-11": 60, "2024-12": 45, "2025-01": 57, "2025-02": 52, "2025-03": 59, "2025-04": 70, "2025-05": 46, "2025-06": 81, "2025-07": 90, "2025-08": 117, "2025-09": 120, "2026-02": 106, "2026-03": 121, "2026-04": 79, "2026-05": 87, "2026-06": 94, "2026-07": 106, "2026-08": 91, "2026-09": 136, "2026-10": 136}, "merge_monthly": {"2023-09": 3, "2024-02": 5, "2024-03": 6, "2023-10": 1, "2024-06": 1, "2024-04": 5, "2024-11": 1, "2024-12": 2, "2024-08": 2, "2025-02": 4, "2024-09": 2, "2025-04": 8, "2025-05": 4, "2025-06": 2, "2025-09": 13, "2025-12": 10, "2025-08": 16, "2025-11": 15, "2025-10": 7, "2025-07": 3, "2026-01": 14, "2026-02": 7, "2026-03": 7, "2026-04": 5, "2026-05": 6, "2026-06": 5, "2026-07": 2, "2026-08": 8, "2026-09": 2, "2026-10": 1}}, "MaskRay": {"avatar_url": "https://avatars.githubusercontent.com/u/416322?v=4", "monthly": {"2023-08": 2, "2023-09": 89, "2023-10": 70, "2023-11": 77, "2023-12": 75, "2024-01": 98, "2024-02": 98, "2024-03": 77, "2024-04": 77, "2024-05": 81, "2024-06": 102, "2024-07": 138, "2025-09": 30, "2025-10": 40, "2025-11": 9, "2025-12": 19, "2026-01": 31, "2024-08": 95, "2024-09": 53, "2024-10": 50, "2024-11": 64, "2024-12": 60, "2025-01": 53, "2025-02": 55, "2025-03": 61, "2025-04": 50, "2025-05": 46, "2025-06": 49, "2025-07": 80, "2025-08": 36, "2026-02": 31, "2026-03": 38, "2026-04": 26, "2026-05": 34, "2026-06": 52, "2026-07": 67, "2026-08": 48, "2026-09": 60, "2026-10": 45}, "comment_monthly": {"2023-08": 2, "2023-09": 106, "2023-10": 93, "2023-11": 92, "2023-12": 90, "2024-01": 117, "2024-02": 123, "2024-03": 94, "2024-04": 92, "2024-05": 93, "2024-06": 125, "2024-07": 165, "2025-08": 41, "2025-09": 37, "2025-10": 46, "2025-11": 14, "2025-12": 23, "2026-01": 37, "2024-08": 109, "2024-09": 58, "2024-10": 61, "2024-11": 75, "2024-12": 72, "2025-01": 65, "2025-02": 65, "2025-03": 75, "2025-04": 60, "2025-05": 56, "2025-06": 55, "2025-07": 94, "2026-02": 36, "2026-03": 47, "2026-04": 39, "2026-05": 44, "2026-06": 61, "2026-07": 76, "2026-08": 53, "2026-09": 67, "2026-10": 53}, "merge_monthly": {"2024-05": 3, "2023-12": 1, "2023-09": 4, "2024-03": 1, "2023-11": 5, "2023-10": 1, "2024-06": 1, "2024-01": 3, "2024-04": 4, "2024-07": 4, "2025-01": 1, "2024-11": 2, "2024-12": 3, "2025-02": 3, "2024-10": 1, "2025-04": 1, "2025-05": 2, "2026-08": 3, "2026-09": 1}}, "fhahn": {"avatar_url": "https://avatars.githubusercontent.com/u/450489?u=4c84b63d078cd6a10b04d46bdcf1f1605e75bd13&v=4", "monthly": {"2023-09": 15, "2023-10": 21, "2023-11": 13, "2023-12": 19, "2024-01": 22, "2024-02": 23, "2024-03": 10, "2024-04": 18, "2024-05": 40, "2024-06": 18, "2024-07": 29, "2024-08": 37, "2024-09": 42, "2024-10": 32, "2024-11": 35, "2024-12": 59, "2025-01": 63, "2025-02": 48, "2025-03": 73, "2025-04": 83, "2025-05": 88, "2025-06": 78, "2025-07": 100, "2025-08": 93, "2025-09": 112, "2025-10": 92, "2025-11": 78, "2025-12": 49, "2026-01": 71, "2026-02": 90, "2026-03": 68, "2026-04": 100, "2026-05": 101, "2026-06": 81, "2026-07": 94, "2026-08": 85, "2026-09": 106, "2026-10": 116}, "comment_monthly": {"2023-09": 20, "2023-10": 24, "2023-11": 17, "2023-12": 27, "2024-01": 27, "2024-02": 29, "2024-03": 15, "2024-04": 26, "2024-05": 49, "2024-06": 27, "2024-07": 37, "2024-08": 42, "2024-09": 45, "2024-10": 34, "2024-11": 44, "2024-12": 67, "2025-01": 70, "2025-02": 49, "2025-03": 73, "2025-04": 85, "2025-05": 88, "2025-06": 78, "2025-07": 101, "2025-08": 92, "2025-09": 113, "2025-10": 93, "2025-11": 80, "2025-12": 48, "2026-01": 76, "2026-02": 91, "2026-03": 68, "2026-04": 100, "2026-05": 101, "2026-06": 80, "2026-07": 93, "2026-08": 85, "2026-09": 105, "2026-10": 116}, "merge_monthly": {"2024-02": 1, "2024-03": 2, "